Credit Note Number,Date,Due Date,Customer Name,Customer VAT,Customer Email,State,Payment State,Amount Untaxed,Amount Tax,Amount Total,Amount Residual,Payment Term,Reference,Origin,Currency,Notes
RINV/2025/00001,2025-02-04,2025-02-04,"Viajes Pacífico, S.A.",A08644932,ccalderon@pacifico-meetings.com;at_proveedores@pacifico-meetings.com,posted,not_paid,6.30,1.32,7.62,7.62,,,,EUR,
RINV/2025/00002,2025-04-11,2025-04-11,"Move Experience Barcelona, S.L.",B65104218,admin@moveexperience.es,posted,paid,16.44,3.45,19.89,0.00,,"Reversión de: INV/2025/00148, Baja del cliente",,EUR,
RINV/2025/00003,2025-04-11,2025-04-11,"Move Experience Barcelona, S.L.",B65104218,admin@moveexperience.es,posted,paid,16.44,3.45,19.89,0.00,,"Reversión de: INV/2025/00232, Baja cliente",,EUR,
RINV/2025/00004,2025-06-03,2025-06-03,"Sasouni, S.L.",B62299680,sasounigranollers@gmail.com,posted,paid,162.90,34.20,197.10,0.00,,Reversión de: INV/2025/00416,,EUR,
RINV/2025/00005,2025-07-08,2025-07-08,"The Face Workout, S.L.",B16720724,admin@theeyelashatelier.com,posted,paid,26.36,5.54,31.90,0.00,,"Reversión de: INV/2025/00459, Cierre",,EUR,
RINV/2025/00006,2025-07-21,2025-07-21,"Discer, S.L.",B58190455,efactura@mdgrup.cat,posted,not_paid,105.00,22.05,127.05,127.05,,,,EUR,
RINV/2025/00007,2025-08-02,2025-08-02,Jorge Ferre Jorge,35012763R,mpilarmongay@gmail.com,posted,paid,36.64,7.69,44.33,0.00,,"Reversión de: INV/2025/00693, Cierre",,EUR,
RINV/2025/00008,2025-08-04,2025-08-04,"Peixos Madir i Fills, S.A.",A62741483,contabilidad@peixosmadir.com,posted,paid,14.95,3.14,18.09,0.00,,"Reversión de: INV/2025/00675, Aun no ha contratado el servicio",,EUR,
